city_state	Raw Text	Normalized Text	Cluster ID	Topic_ids	summary	keywords
 Rochester, NY	"WHAT’S INSIDE
Our Vision 1
Our Popula Ɵ on Characteris Ɵ cs 6
Other Characteris Ɵ cs 7
Preliminary Site Map 9
Our Approach 10
Risk Management 19
Our Team 20
Our System 21
Data Collec Ɵ on 24
Architecture, Standards & Processes 26
Goals & Objec Ɵ ves 27
Evidence of Capacity 28
Opportuni Ɵ es to Leverage 
Federal Resources      29
LeƩ ers of Commitment are in Appendix AOUR VISION
The City of Rochester is resurgent. Historically 
one of America’s ﬁ  rst “boomtowns,” Rochester 
has more recently endured a half-century of decline, causing job-loss, reduced private sector sources of regional funding, and a high percentage of poverty-stricken ci Ɵ zens. 
Today, our city is experiencing a wave of revitalizaƟ on. Thousands of units of new 
housing have or soon will be built in the Center City, and an emerging Downtown InnovaƟ on Zone is genera Ɵ ng high quality 
jobs and investment. These combined forces have changed the fortunes of our urban core, where the focus is now on managing growth rather than stemming decline. Whether dissecƟ  ng the Midtown Plaza superblock, 
removing the sunken Inner Loop Expressway, developing intermodal transporta Ɵ on hubs, or 
aggressively building out an extensive bicycle network, the City of Rochester is commiƩ  ed to 
creaƟ ng a smart, sustainable city for the 21st 
Century.
However, our city and region faces a cri Ɵ cal 
test that will determine whether or not that 
21st Century city meets the needs of all of our residents. In spite of its abundant resources and apparent wealth, Rochester, when compared to other mid-sized ci Ɵ es, is home 
to a crippling concentra Ɵ on of urban poverty. 
Recent studies indicate that Rochester has the highest rate of child poverty, the highest rate of extreme poverty, and the second-highest rate of poverty overall in the na Ɵ on. Unless the 
rate and scale of poverty in our community is addressed, the city and region will struggle to meet its full poten Ɵ al.
Through the leadership of Mayor Lovely Warren and Governor Andrew Cuomo, in coordinaƟ on with a broad public, private, 
and non-pro ﬁ t iniƟ aƟ ve, the community has 
targeted a 50% reduc Ɵ on in poverty over the next 15 years. To that end, Rochester recognizes the unique opportunity that the Smart City Challenge provides to dedicate technological advancements in the transporta Ɵ on sector to achieve our goal of 
reducing urban poverty and improving the quality of life for all ci Ɵ zens. This will be done 
in three ways: improving safety for travelling ciƟ zens, enhancing mobility by crea Ɵ ng more 
and beƩ er travel op Ɵ ons, and advancing 
environmental sustainability by reducing energy consump Ɵ on and greenhouse gases 
(GHG). 
By invesƟ ng in the Smart City Challenge and 
leveraging private sector funds, we will be 
able to enhance long-term transporta Ɵ on 
soluƟ ons that be Ʃ er connect communi Ɵ es 
to employment centers, educa Ɵ on centers, 
health care facili Ɵ es, and services. The City 
of Rochester and its assembled consor Ɵ um 
of partners, is commiƩ  
ed to successful 
implementa Ɵ on of the Smart City Challenge. If 
awarded, the results achieved in Rochester will be replicable in ci Ɵ es across the country.
TransportaƟ  on & Poverty
Transporta Ɵ on has played a regre Ʃ able 
role in crea Ɵ ng an environment in which 
poverty can concentrate and spread. CiƟ  es 
have historically grown outward with each transporta Ɵ on innova Ɵ on as faster, more 
eﬃ  cient transporta Ɵ on services enabled 
people to live further from the historic center. This phenomenon is nothing new. However, the prolifera Ɵ on of the car, coupled with 
supporƟ ve infrastructure, land use, and 
ﬁ nancial policies, enabled this to take place on 
a massive scale beginning in the 1950s.
The impact on ci Ɵ es such as Rochester was 
two-fold. First and foremost, suburbaniza Ɵ on 
robbed ci Ɵ es of a signi ﬁ cant share of their 
middle and upper-income families, leaving Our goal is to reduce poverty by 50% in 15 years, using 
our Smart City Vision as a driving force of change. 
City of Rochester, NY | 1ROC FORWARD»»»behind a largely poor and working-class 
populace. The City of Rochester’s popula Ɵ on 
peaked in 1950 at over 330,000; today, the City’s popula Ɵ on is just over 210,000, a loss 
of more than one-third. Secondly, the rush to serve the car and compete with suburban development led ciƟ  es to make poor decisions 
or allow such decisions to be made on their behalf. These decisions included wholesale demoliƟ on of neighborhoods to accommodate 
interstates and expressways, o Ō en built 
through established African-American communi Ɵ es; widening of streets to increase 
vehicular throughput, typically at the expense of bicyclists and pedestrians; removal of streetcar and trolley lines from city streets and corridors; and demoli Ɵ on of historic buildings 
and streets in favor of parking facili Ɵ es and 
car-oriented development. 
Rochester, like many ci Ɵ es, was scarred by 
these decisions. As much of the historic 
fabric of the city was destroyed, the social networks that bound residents and businesses together were lost as well. As people le Ō  
the city, businesses followed, crea Ɵ ng a 
downward spiral of disinvestment in many neighborhoods. This also created a spa Ɵ al 
mismatch between new job opportuni Ɵ es and 
lower-income residents. As jobs migrated to the periphery, inner city residents’ ability to access them became strained; this, combined with a host of other factors, ul Ɵ mately resulted 
in chronic unemployment and poverty in city neighborhoods.Transporta Ɵ on is neither the cause of nor 
soluƟ on to poverty. However, it is undeniable 
that transporta Ɵ on is a contribu Ɵ ng factor 
and that e ﬀ orts to improve accessibility and 
mobility for all residents can signi ﬁ cantly 
improve outcomes for our city’s most disadvantaged. Take Sheila for example; she resides in a city neighborhood and works a low-wage job at a small manufacturer a short walk from home. Sheila is able to stay out of poverty in part because, although she does not own a car, most everything she needs is located within her local community. Day care, grocery, health care, and employment are all within easy reach. 
However, the employer decides to relocate the 
business to a suburban site ten miles away. The new locaƟ on is too far to walk or bike and is 
poorly served by transit. Sheila cannot a ﬀ ord a 
car on her salary and must rely on the current transit service. Because bus service is not as frequent in this low-density suburban area, she must now add 90 minutes to her daily commute each way. Her day care provider can no longer accommodate her child’s schedule and so a new provider is found, adding another 30 minutes to the commute. Sheila’s health and that of her child su ﬀ er as doctor visits 
must be curtailed. She o Ō en shows up late to 
work due to the ﬂ  uctuaƟ ons in travel Ɵ mes 
caused by tra ﬃ  c condiƟ ons, weather, and 
other events out of her control. This prompts her employer to terminate her posiƟ  on. With 
no comparable employment opportuni Ɵ es in 
HIGHEST
The highest rate of  
childhood poverty (50.1%) The highest rate of  
extreme povertyThe second-highest rate  
of poverty in the nation HIGHEST SECOND-HIGHEST
Rochester’s Poverty Issue by the Numbers: according to a September 2015 Rochester Monroe AnƟ -Poverty IniƟ  aƟ ve report. 
City of Rochester, NY | 2ROC FORWARD»»»her neighborhood, Sheila and her child are 
now living in poverty.
This is a very common scenario playing out 
in Rochester and in ci Ɵ es naƟ onwide. Unless 
addressed, it threatens our na Ɵ on’s future 
economic compe Ɵ Ɵ veness. Yet it presents a 
unique opportunity to use the resources of the Smart City Challenge to make our ci Ɵ es’ future 
transporta Ɵ on system work for all residents. 
This is Rochester’s challenge - one that we are well prepared to address.
Mayor Warren has taken steps to drive change, 
launching the Mayor’s O ﬃ  ce of Innova Ɵ on 
and Strategic Ini Ɵ aƟ ves, and leading the 
Rochester-Monroe An Ɵ -Poverty Ini Ɵ aƟ ve 
(RMAPI). Together with key agency partners, the City is preparing new program and policy recommenda Ɵ ons to impact poverty, including 
issues of transporta Ɵ on. The program has 
state level support from the oﬃ   ce of Governor 
Cuomo and direct communica Ɵ ons with a task 
force comprised of high level New York State oﬃ  cials. Governor Cuomo is already poin Ɵ ng 
to the eﬀ ort as an example for other states to 
follow.RMAPI and the City recently approved an anƟ -poverty target area encompassing three 
conƟ  guous neighborhoods. This target area 
will be where we will test and measure the impact of new an Ɵ -poverty strategies. The 
area was selected through a data driven process that iden Ɵ ﬁ ed an area with good 
exisƟ ng resources that is impacted by 
socioeconomic issues. The O ﬃ  ce of Innova Ɵ on 
will help design programs with data sharing best pracƟ  ces, and ensure capabili Ɵ es to track 
long term individual outcomes. The O ﬃ  ce will 
also be retained to evaluate program impact, and help make modi ﬁ caƟ ons when necessary. 
Given the a Ʃ enƟ 
on, investment, data sharing, 
and evalua Ɵ on about to occur within this 
area, it is an ideal loca Ɵ on to also pilot new 
transporta Ɵ on technologies designed to 
posiƟ vely impact people in poverty.
hGF
GFGF
GF14621
CONEA
BEECHWOOD
EMMABENSONHURST
NEIGHBORHOOD OF THE ARTSN. MARKETVIEW HEIGHTS
CENTRAL BUSINESS DISTRICT
NORTH WINTON VILLAGES. MARKETVIEW HEIGHTS
PARK MEIGSNEMNU
PARK CENTRALNORTH WINTON VILLAGECULVER MERCHANTS
CORN HILL WADSWORTH SQUARE CULVER UNIVERSITY EASTMainBay
EastClifford
Culverth
ScioUnion
Clintoneph
Atlan ticUniversityson
Portland
Broad
ParkWebster
GoodmanSouth
Alexander
Ches
tnutSt 
Pa
ulCart
er
AndrewsMe
rchant
s
Central
Exchange
MonroeWoodburyNiagara Draper
CircleClev eland
BroadwayUniversityGoodman
Libraries
Recreation Centers
3City Schools
!U Social Service Providers
GF Healthcare Providers
h Employment Services
Pilot Area BoundaryMapped by Henry Fitts
City of Rochester
Office of Innovation and Strategic Initiatives
December 2015
The AnƟ -Poverty Target Area: the neighborhoods of Marketview, Beechwood, and 
EMMA. 
City of Rochester, NY | 3ROC FORWARD»»»Our Proposed Elements
The City of Rochester and its partners intend to 
develop a 21st Century transporta Ɵ on system 
that addresses our mobility and safety needs while growing the local and regional economy and oﬀ ering a stairway out of poverty. A 
primary focus will be on enhancing transit accessibility for our residents, 73% of whom are underserved by public transporta Ɵ on. 
We must face our challenges directly, creaƟ ng a path to quality jobs for our ci Ɵ zens 
while building a more robust and smart transporta Ɵ on system. This is consistent with 
our stated vision and with the USDOT Ladders of Opportunity Ini Ɵ aƟ ve promoted under 
Secretary Foxx’s leadership. By inves Ɵ ng in 
Rochester’s Smart City vision and leveraging private sector funding, we will create an enhanced transporta Ɵ on network that be Ʃ er 
connects our residents to employment, educaƟ on, health care, and other services. 
Our goal is to accelerate ongoing e ﬀ orts to re-
establish Rochester as a global innova Ɵ on hub. 
Through this program, we can create up to 10,000 high quality jobs in Rochester by 2020 and rebuild our manufacturing base in the process. The City and region are determined to work with our partners in the public and private sectors to have Connected Shared Automated Vehicles (CSAV) built in Rochester and the USA. We are engaged in preliminary discussions with EasyMile, one of our key partners in this endeavor, regarding this manufacturing facility. 
The USDOT Smart City Challenge has shone 
a light on innova Ɵ ve opera Ɵ onal strategies 
and technologies such as connected vehicles (CV) and automated vehicles (AV), o ﬀ ering 
new hope for addressing the complex transporta Ɵ on challenges we face as a 
naƟ on and nourishing hopes for con Ɵ nued 
economic prosperity. It’s clear that we cannot rely on past solu Ɵ ons to work in today’s 
environment. Ci Ɵ es like Rochester constantly 
face the dilemma of doing more with less. The growing frustra Ɵ on of travelers, combined 
with worsening infrastructure performance, demand that new and innova Ɵ ve strategies be 
developed. The applica Ɵ on of CSAV shu Ʃ les 
for the ﬁ  rst and last mile o ﬀ ers the poten Ɵ al for signi ﬁ cant performance improvements 
at much lower costs and in much faster Ɵ meframes than previously possible. These 
soluƟ ons are scalable and synergize with 
our City’s investments in mul Ɵ -modal 
transporta Ɵ on improvements to meet the 
needs of our residents, now and in the future. 
The City of Rochester has assembled an 
impressive consor Ɵ um of local, regional, and 
state agencies and organiza Ɵ ons, 
 insƟ tuƟ ons 
of higher learning, and industry partners who are commiƩ  ed to the success of Rochester’s 
vision for the Smart City Challenge and addressing an Ɵ -poverty iniƟ  aƟ ves. Highlights 
of the primary proposed elements are listed below:
Urban Automa Ɵ on – partnership 
between the City, EasyMile, Kodak, and the Rochester Genesee Regional Transporta Ɵ on Authority 
(RGRTA) to deploy automated 
transit shu Ʃ les on the internal street network 
of Eastman Business Park (EBP), a 1,200-acre private technology campus in the City of Rochester. This will solve ﬁ rst/last-mile 
issues with transit accessibility, demonstrate the eﬀ ecƟ veness of automated transit, 
and posiƟ on EBP and Rochester for future 
economic growth. Upon successful tes Ɵ ng 
at EBP , it is an Ɵ cipated that deployment 
would transi Ɵ on to public streets in the City 
of Rochester, with early deployment focused on the an Ɵ -poverty target area and/or the 
Downtown Innova Ɵ on Zone. The City will work 
with New York State to enact legisla Ɵ on that 
facilitates automated vehicle deployment iniƟ ally in Rochester and then expanding 
statewide. 
Intelligent, Sensor-Based Infrastructure – partnership between the City and GE to deploy GE’s Current technology via the City’s extensive street ligh Ɵ ng 
system. This technology uses 
intelligent LED light ﬁ xtures ou ƞ iƩ ed with 
sensors, transmiƩ  ers, and microprocessors 
to create a comprehensive data grid oﬀ  ering 
unparalleled possibili Ɵ es for a variety of 
considera Ɵ ons, such as tra ﬃ  c opƟ mizaƟ on, 
parking management, asset oversight, and environmental awareness.
City of Rochester, NY | 4ROC FORWARD»»»Urban Analy Ɵ cs – partnership 
between IBM, RIT, and the City 
to harness the power of Big Data and RIT’s intellectual capacity to 
address a wide variety of municipal 
needs, such as performance measurement, service delivery op Ɵ mizaƟ on, and public 
informaƟ on sharing.
User-Focused Mobility Services and Choices  – partnership between 
Xerox, RGRTA, shared mobility service providers, and the City to develop a leading edge applica Ɵ on 
for real-Ɵ  me transporta Ɵ on informa Ɵ on to 
enable be Ʃ er decision-making with respect 
to travel op Ɵ ons and integrated payment for 
those opƟ ons. This will advance the “Mobility 
on Demand” concept and facilitate more of our residents to choose car-free or car-light lifestyles. Interoperable, mobile fare payment combining a wide variety of travel op Ɵ ons 
(transit, rideshare, carshare, bikeshare, taxi, parking, etc.) is the goal and equitable access for un-banked residents without access to credit is a primary considera Ɵ on.
Urban Delivery & Logis Ɵ cs – 
partnership between Verdant Global and the City to establish a highly-e ﬃ  cient, automated 
AgriFactory at an exis Ɵ ng vacant 
warehouse in the City of Rochester. The Verdant AgriFactory will demonstrate a leap beyond tradi Ɵ onal greenhouse produc Ɵ on, 
yielding signi ﬁ cantly more fresh healthy 
produce than previously thought possible while also repurposing exis Ɵ ng vacant 
warehouse space that is easily accessible to urban popula Ɵ ons. This technological 
advancement has the poten Ɵ al to signi ﬁ cantly 
reduce emissions by elimina Ɵ ng ineﬃ  cient 
long-range transport of produce. Its fully automated system lends itself to local distribuƟ on via connected and/or automated 
vehicles, just-in- Ɵ me delivery techniques, and 
use of analy Ɵ cs to minimize con ﬂ icts between 
delivery and tra ﬃ  c needs on city streets.
Implementa Ɵ on of Rochester’s vision for a 
Smart City will enable the USA to demonstrate global leadership in these emerging technologies, clearing the way for safer, more mobile, and sustainable ci Ɵ es. Furthermore, successful implementa Ɵ on will help Rochester, 
and ciƟ es naƟ on
wide, a Ʃ ack urban poverty 
and improve the quality of life for those living in poverty. Rochester is a smaller city, enabling us to be more nimble and allowing the federal dollars to fund more innova Ɵ ve soluƟ ons. 
Our collabora Ɵ ve, coopera Ɵ ve environment 
minimizes risk, providing assurance that our city and region is focused on delivering a Smart City focused on the future. The consorƟ um that will guide this investment 
is wide-reaching, demonstra Ɵ ng that our 
community is suppor Ɵ ve of and invested in 
implemen Ɵ ng the Smart City Challenge.
Program Management
Implementa Ɵ on of a comprehensive 
governance framework is cri Ɵ cal to ensuring 
interagency collabora Ɵ on and transparent 
accountability throughout the life of the Smart City Challenge. The City of Rochester will serve as the primary Point of Contact with USDOT for all aspects of the Smart City Challenge. To assist City sta ﬀ  and leadership 
with management responsibili Ɵ es, Stantec 
will provide project management services and technical exper Ɵ se, working closely with 
all project partners to ensure successful implementa Ɵ on of the City’s vision. It is 
anƟ cipated that a Governing Board, chaired 
by the Mayor and consis Ɵ ng of high-
ranking o ﬃ  cials from the many public and 
City of Rochester, NY | 5ROC FORWARD»»»private sector partners, will provide high-
level oversight of the Smart City program. A Technical Council will provide ongoing operaƟ onal management of research and 
technical ac Ɵ viƟ es. The City Engineer will 
chair the Council, assisted by Stantec, with staﬀ -level representa Ɵ on from all project 
partners. The City’s Director of Innova Ɵ on will 
serve as Chief Data Oﬃ   cer for the purposes 
of the Smart City Challenge. Lastly, a Ci Ɵ zens 
Advisory CommiƩ  ee will be established with 
representa Ɵ on from City sta ﬀ , Stantec, and 
the many public advocacy organiza Ɵ ons 
that will help to ensure that the Smart City iniƟ aƟ ves are mee Ɵ ng the needs of the public. 
The Commi Ʃ ee will elect a Chairperson 
from among its members, who will then serve on the Governing Board and appoint a representa Ɵ ve to serve on the Technical 
Council.POPULATION CHARACTERISTICS
Rochester is an ideal candidate for the Smart City Challenge. According to the 2010 Census, Rochester has a popula Ɵ on of 210,565 
represenƟ ng a signi ﬁ cant share of the overall 
populaƟ on (29%) living within the urbanized 
area. The 35.78 square miles of land that comprise the City exhibit a density of 5,884.9 persons per square mile. Rochester is the third-largest city in New York State. It is the seat of Monroe County, which had a 2010 populaƟ on of 744,344. The city is at the center 
of a larger six-county metropolitan area which had a popula Ɵ on of 1,079,671 in 2010. 
Rochester is also a very diverse place. 41.7% of the popula Ɵ on is African American, 37.6% 
is White, 16.4% is Hispanic or La Ɵ no, 3.1% 
is Asian and 1.2% is American Indian, Alaska NaƟ ve or NaƟ ve Hawaiian. Further, recent 
Census data indicates that Rochester has the highest rate of child poverty (50.1%), the highest rate of extreme poverty, and the second-highest rate of poverty overall in the naƟ on. With a diverse popula Ɵ on 
and residents facing economic hardships, successful implementa Ɵ on of Smart City 
elements in Rochester will have broad applicability in ci Ɵ es naƟ onwide.
City of Rochester, New YorkU.S. Department of Transporta Ɵ on
      Stantec Program ManagerGovernance Board
Board Chair - Mayor Warren
Technical Council
Council Chair - City Engineer
Chief Data O ﬃ  cerCiƟ zen Council
Council Chair*
*Elected by Members
City of Rochester, NY | 6ROC FORWARD»»»OTHER 
CHARACTERISTICS
ExisƟ ng TransportaƟ  on 
System
Fixed route bus transit service in the City of Rochester and broader region is provided by the Rochester Genesee Regional Transporta Ɵ on Authority’s Regional Transit 
Service (RTS). RTS currently operates more than 40 routes serving the city and neighboring suburbs. More than 18 million riders uƟ  lized RTS on an annual basis.
Conducive Environment
Rochester is one of America’s most crea Ɵ ve 
communi Ɵ es. We rank among the top 
communi Ɵ es for patents issued per capita as 
well as the percentage of workers in crea Ɵ ve 
industries. The talent pool and our collec Ɵ ve 
capabiliƟ es are well-regarded. In summer 
2015, Rochester was named the home for the new American Ins Ɵ tute for Manufacturing 
Integrated Photonics, a Na Ɵ onal Network 
for Manufacturing Innova Ɵ on (NNMI) 
insƟ tute. It is no surprise that our City is 
well-posiƟ oned to take a lead role among US ciƟ es to demonstrate and deploy advanced 
transporta Ɵ on technologies. 
Leadership Con Ɵ nuity
The City of Rochester is a Strong Mayor-Council government system. In this system, the Mayor possesses wide-ranging administra Ɵ ve 
control over government func Ɵ ons. Mayor 
Lovely A. Warren is in the third year of her ﬁ  rst 
term as Mayor and has already announced her intenƟ on to seek re-elec Ɵ on to a second term. 
The primary sta ﬀ  members are long-term 
municipal employees who possess signi ﬁ cant 
experience with federal projects and programs. At the outset of the program, a succession plan will be developed to ensure con Ɵ nuity should 
leadership or sta ﬀ -level changes take place.
The project will be managed by the City’s Bureau of Architecture & Engineering and overseen by the consultant team at Stantec, a global ﬁ rm with recognized special Ɵ es in 
advanced transporta Ɵ on technology. Stantec’s 
involvement will also ensure con Ɵ nuity 
and conƟ nued focus on successful program 
delivery. 
Sharing Economy
Rochester is home to a strong tradi Ɵ on of 
grassroots community development and alternaƟ ve thinking. The City is currently 
working to support the sharing economy and 
City of Rochester, NY | 7ROC FORWARD»»»alternaƟ ve ownership structures designed 
to develop a more economically inclusive 
community. In the last few years several e ﬀ orts 
have popped up in these areas: 
Market Driven Community Coopera Ɵ ves 
Since 2014, the Mayor’s O ﬃ  ce of Innova Ɵ on 
has been inves Ɵ gaƟ ng the poten Ɵ al for 
economic development strategies centered around worker-owned coopera Ɵ ve businesses. 
These businesses are designed to create entry level employment opportuni Ɵ es in some of 
Rochester’s most distressed neighborhoods.
Democracy Collabora Ɵ ve, a naƟ onal leader in 
community wealth building and worker-owned 
cooperaƟ ve development, recently completed 
a study looking into the feasibility of this strategy in Rochester. Democracy Collabora Ɵ ve 
remains involved with the Evergreen CooperaƟ ves, a successful model in Cleveland, 
Ohio that links new worker-owned businesses to the supply chain needs of local anchor insƟ tuƟ ons like universi Ɵ es and hospitals. 
The study iden Ɵ ﬁ ed signi ﬁ cant local 
anchor interest and six speci ﬁ c business 
opportuni Ɵ es based on market research. 
Democracy Collabora Ɵ ve is recommending 
forming a non-pro ﬁ t holding company to 
provide administra Ɵ ve and human resources 
support to subsidiary for-pro ﬁ t worker-owned 
businesses. The non-pro ﬁ t will also manage a 
revolving loan pool and business development services to help launch new worker-owned businesses. The Mayor and City Council are highly excited about the poten Ɵ al for this 
project, and are funding the next phase of the project to ensure businesses will be operaƟ onal in early 2017. 
Kiva Rochester Chapter - Though Rochester 
has a robust small-business community, many entrepreneurs and would-be business owners face insurmountable ﬁ nancial 
barriers when trying to launch or expand their businesses due to restric Ɵ ve lending 
policies and assessments of risk. Kiva is an internaƟ onal crowdfunding micro ﬁ nance 
insƟ tuƟ on that provides 0% interest loans to 
low-income and underserved entrepreneurs and small businesses. Funding for the loans is secured through internet crowdfunding as well as matching funds from community organizaƟ ons. The loans are issued to quali ﬁ ed 
borrowers following a process that evaluates and establishes creditworthiness. Borrowers undergo an assessment of creditworthiness through a process of social underwri Ɵ ng, 
in which char
acter and strength of support 
networks - as opposed to exclusionary criteria such as FICO scores, collateral, and cash ﬂ ow 
- are used as the best indicators of success. Borrowers pay back the loans to Kiva, who then reissues the funds to other quali ﬁ ed 
borrowers. 
The City is currently working with the 
Rochester Area Community Founda Ɵ on and 
