city_state	Raw Text	Normalized Text	Cluster ID	Topic_ids	summary	keywords
NYC’s and Long Island’s embrace of this clean technology. The outcome will be: 
 »25 EV charging sta Ɵ ons (5 in each region) 
strategically installed in cri Ɵ cal areas to 
enable greater EV use. 
 »Educated municipali Ɵ es on EV charging 
staƟ on permi ƫ  ng and communi Ɵ es on EV 
technology. 
 »900 rebates for EV purchases to spur EV sales and establish more EV advocates (the new EV owners), and 
 »40 ride-n-drive events to promote EVs and allow consumers a test drive opportunity of diﬀ erent makes and models.
Second, the Rochester EV Deployment Community will foster a model EV Community in which EVs are embraced by the public and promoted by business and government. This approach moves EVs from a niche product into a dominant and ubiquitous concept. The outcomes will be: 
 »9 EV charging sta Ɵ ons in City of Rochester 
g
arages for public and city-owned EVs. 
City of Rochester, NY | 23ROC FORWARD»»» »EVs for the City of Rochester as an 
ambassador of the technology and to showcase their opera Ɵ on. 
 »extensive community engagement to inform and educate the residents and businesses throughout the City about the bene ﬁ ts of EVs. The Rochester EV 
Deployment Community will create replicable models for other New York communi Ɵ es to use for accelera Ɵ ng EV 
adopƟ on.
DATA COLLECTION
Current Data Collec Ɵ on
The City has been con Ɵ nuously building 
capacity to capture and analyze data to inform decision making and measure outcomes. It has a history of sound prac Ɵ ce in these areas 
especially in areas of grant management outcome tracking and in the investment and planning decisions in the Department of Neighborhood and Business Development.
The City recently overhauled its Geographic 
InformaƟ on Systems and related IT 
infrastructure. This has greatly improved the access and sharing of data within the City organizaƟ ons of not only of GIS data, but all 
the City source data and other available public data.
In spring 2015 the City launched the O ﬃ  ce of 
InnovaƟ on and Strategic Ini Ɵ aƟ ves, a research 
and strategy team repor Ɵ ng to Mayor Lovely 
A. Warren. One major focus of the team is to 
ensure that scien Ɵ ﬁ c tracking and outcome 
measurement are the founda Ɵ on of any new 
City iniƟ aƟ ves. This is not only to help evaluate 
progress and track success, but also to posi Ɵ on 
iniƟ aƟ ves for more sustainable funding 
opportuni Ɵ es. 
The City and the O ﬃ  ce of Innova Ɵ on is an 
integral partner in the Rochester Monroe AnƟ poverty Ini Ɵ aƟ ve (RMAPI), a large 
consorƟ um of government and non-pro ﬁ ts 
working to impact poverty in Rochester. Together, the RMAPI and the City will insƟ tute an an Ɵ -poverty program in a pilot district to test e ﬀ ecƟ veness and measure 
impact. Through this partnership, the O ﬃ  ce 
of Innova Ɵ on will work with local and 
state experts to design metric tracking that taps into data assets from non-pro ﬁ ts and 
government agencies to track long-term individual outcomes and geographic trends. It will also work to implement best prac Ɵ ces 
in data security, and privacy standards. As these programs move toward implementa Ɵ on, 
staﬀ  responsible for sensi Ɵ ve personal data 
will undergo training on privacy and security protocol. 
The City currently has in place data sharing 
agreements with the City School District, the 
loc
al Library system, and Monroe County. It 
shares data on students, library patrons, and recreaƟ on center users. The City primarily 
shares property assessment data and street asset data with the County. The City has also has expanded data sharing in partnership with Gov. Cuomo’s Open NY data ini Ɵ aƟ ve. The 
Police Department also receives shared data from the NYS Department of CorrecƟ  ons and 
Community Supervision and other state and federal law enforcement agencies to help track and improve police strategy.
We have experience in and can leverage 
data from a variety of sources such as tra ﬃ  c 
cameras, other sensors, and social media to enable opportuni Ɵ es to opƟ mize opera Ɵ ons 
(traﬃ  c ﬂ ow, automated tra ﬃ  c sign detecƟ  on, 
and recogni Ɵ on), monitor infrastructure 
condiƟ ons (road condi Ɵ ons, snow condi Ɵ ons, 
pot holes), infrastructure planning (public transit), tra ﬃ  c enforcement (detec Ɵ ng 
passenger compartment viola Ɵ ons, speeding 
violaƟ ons), popula Ɵ on senƟ ment detec Ɵ on 
for city agency policies, and system health monitoring.
In addiƟ on to City data collec Ɵ on systems, 
Genesee Transporta Ɵ on Council (GTC) 
commissions an annual land use monitoring 
project conducted by the Monroe County Department of Planning and Development that includes the City of Rochester. The most recent year for which data collec Ɵ on and analysis is 
complete is 2014. 
GTC has also contracted with INRIX to provide 
probe-based travel Ɵ  me data for the region, 
City of Rochester, NY | 24ROC FORWARD»»»including access to INRIX Analy Ɵ cs. GTC 
has access to historic and real- Ɵ me travel 
data. GTC’s agreement with INRIX allows 
for member agencies, including the City of Rochester, to access and use this data.
GTC supports the Monroe County Department 
of Transporta Ɵ on’s (MCDOT) e ﬀ ort to collect 
traﬃ  c volume and classi ﬁ caƟ on counts 
in the City on a periodic basis. This data complements the e ﬀ orts of the New York State 
Department of Transporta Ɵ on (NYSDOT) to 
collect tra ﬃ  c volume and classi ﬁ caƟ on counts 
for the Highway Performance Monitoring System (HPMS).
Further, GTC is responsible for the 
development and on-going maintenance of a Regional Travel Demand Model and regularly conducts analyses for member agencies, including the City of Rochester, and other municipali Ɵ es in the Rochester Metropolitan 
Planning Associa Ɵ on.
Regional Transit Service (RTS) collects the following data for the transit system:
 »Ridership data by route and stop based upon the use of the farebox on the bus.
 »Ridership data by route and stop based upon the number of people who walk on the and o ﬀ  the bus. 
 »Smartcard and fare media pass tracking by serial number.
 »Real-Time GPS loca Ɵ on of the bus at each 
stop.
 »Customer and organiza Ɵ on contact 
InformaƟ on through call center, fare 
media, social media, in person, and through e-mail.
A wealth of data is currently being collected, analyzed and employed to enhance the transporta Ɵ on system and the economic 
environment of the City.
New Data Collec Ɵ on
The essen Ɵ al goal for technologies addressing 
data collec Ɵ on is the wealth of disparate 
systems and data sources involved. This Big Data problem exists in every city today. This inability to collect, analyze, and sharing between the various city transporta Ɵ on 
systems and human service organiza Ɵ ons is 
common to most ci Ɵ es across our na Ɵ on. 
The development of a standardized set of data workﬂ  ow processes, security standards, 
architectural design, and search criteria, will bene ﬁ t many ciƟ  es by reducing this disparate 
data gathering and sharing processes. 
The City and RMAPI are currently working 
closely with the NYS Poverty Task Force, a group of high level state oﬃ   cials to formalize 
data sharing agreements with NYS OTDA/Monroe County Department of Human Services (Public Bene ﬁ ts), NYS Department of 
Labor, and NYS Department of Correc Ɵ ons and 
Community Supervision. We will expand this sharing agreement to include our addi Ɵ onal 
public partners (MCDOT, NYSDOT, RTS) as well as our private partners, (XEROX, IBM, GE, etc.) This will be essen Ɵ al to track and demonstrate 
long term outcomes for individuals interac Ɵ ng 
with the Smart City Challenge team.
The IBM Smarter CiƟ  es Challenge Report, 
dated January 27, 2016, provided a thorough 
outline for data collec Ɵ on and data governance 
as related to an Ɵ -poverty iniƟ  aƟ ves. In a 
coordinaƟ on eﬀ ort, our team will adopt a 
similar structure as described in the following manner:
Master data
Data strategy and designRelationship between master and 
transactional views of the dataTransactional dataData models Data standards Data rules Data policies Data quality
AnalyticsOperations
A Model for Data Governance: from IBM’s Smarter Ci Ɵ es Challenge Report
City of Rochester, NY | 25ROC FORWARD»»»Data governance
 »Establish a Data Hub for collabora Ɵ on – 
this hub will centralize informa Ɵ on for all 
parƟ cipants.
 »Assign Data Stewards for the Data Hub  – 
each partner will iden Ɵ fy a data liaison and 
will appoint data stewards with clear roles 
and responsibili Ɵ es.
 »Deﬁ ne and Publish Data-sharing Policies 
and Guidelines  – create a data coali Ɵ on 
agreement for all members of the Hub.
 »Appoint a Chief Data O ﬃ  cer (CDO) – 
the primary role of the CDO will be to understand, advocate, and govern on behalf of the data.
 »Determine data governance ac Ɵ ons  – 
develop and implement a data strategy with clear objec Ɵ ves, data quality 
management processes, data standards, and data policies.
 »Enable data analyƟ  cs – build capabili Ɵ es 
to develop analy Ɵ cal models and outcome 
measurements.
ARCHITECTURE, STANDARDS & PROCESSES
The City of Rochester and other regional transporta Ɵ on agencies (GTC, Monroe 
County, and NYSDOT) who are par Ɵ cipaƟ ng 
in this project are also par Ɵ cipaƟ ng in the 
development and update of the Rochester’s Regional ITS Architecture. Projects from the 2011 ITS Strategic Plan are integrated into the Regional ITS Architecture and evaluated for consistency with the New York State-wide ITS Architecture. Updates to the Regional ITS Architecture are undertaken as o Ō en as 
needed. The 2011 ITS Strategic Plan called for applying a consistent set of standards to tra ﬃ  c 
signals, communica Ɵ ons, and data interchange 
across the region. All projects undergo a governance review to ensure they conform to the recommenda Ɵ ons of the strategic plan and 
ITS architecture. Furthermore, when developing the system requirements for our Smart City vision we will ensure compliancy with IEEE and ISO Standards as established by IEEE 1233: correct, compaƟ ble, complete, feasible, veri ﬁ able, 
traceable, and modi ﬁ able. The requirements 
will be developed based on USDOT guidance as well.
With respect to interacƟ  ng and sharing lessons 
learned with the standards development 
organizaƟ ons (SDOs), a number of state and 
regional transporta Ɵ on staﬀ  are acƟ ve and 
parƟ cipate in ITS standard development 
eﬀ orts. Our private sector partners are 
naƟ onal and interna Ɵ onal leaders in the US 
standard development ac Ɵ viƟ es. For example, 
Koorosh Olyai is the chair of the US delega Ɵ on 
to the Interna Ɵ onal Standards Organiza Ɵ on 
Technical Commi Ʃ ee 204 (ISO TC 204) which is 
responsible for development of ITS Standards as well as a harmonized connected vehicle (CV) suite of standards. Our team members are also members of the SAE and IEEE connected vehicle and communica Ɵ ons standards groups 
who are promulga Ɵ ng Internet of Things (IoT), 
Communica Ɵ ons (DSRC), Big Data, Connected 
Vehicle (CV) and Automated Vehicle (AV) standards. These are cri Ɵ cal in deploying a 
consistent set of standards for this challenge. We strongly support development of standards for interoperability purposes na Ɵ onally. 
With respect to interacƟ  ng and sharing lessons 
learned with the standards development organizaƟ ons (SDOs), a number of New York 
State and City of Rochester transporta Ɵ on 
staﬀ 
 are acƟ ve and parƟ  cipate in ITS standard 
development e ﬀ orts.  Our private sector 
partners are Na Ɵ onal and Interna Ɵ onal 
leaders in the US standard development acƟ viƟ es, for example, Koorosh Olyai is the 
chair of the US delega Ɵ on to the Interna Ɵ onal 
Standards Organiza Ɵ on Technical Commi Ʃ ee 
204 (ISO TC 204) which is responsible for development of ITS Standards as well as a harmonized connected vehicle (CV) suite of standards.  Our team members are also members of the SAE and IEEE connected vehicle and communica Ɵ ons standards groups 
who are promulga Ɵ ng Internet of Things (IoT), 
Communica Ɵ ons (DSRC), Big Data, Connected 
Vehicle (CV) and Automated Vehicle (AV) standards. These are cri Ɵ cal in deploying a 
City of Rochester, NY | 26ROC FORWARD»»»consistent set of standards for this challenge.  
We strongly support development of standards for interoperability purposes na Ɵ onally.
GOALS & OBJECTIVES
When you look at the history of transporta Ɵ on 
in our community, the economy of the City of Rochester has been determined in no small part by transporta Ɵ on assets, such as 
the Erie Canal, the railroads, and the growth of the interstate system. Now, building on these assets, the City of Rochester’s vision is structured to strengthen our transporta Ɵ on 
network in the 21st Century by leveraging advanced technologies to address the challenges we have in safety, mobility, sustainability, economic vitality, and climate change. Rochester is ready to connect everything.
Rochester will move be Ʃ er by 
enhancing mobility.
In the 21st Century, Rochester will focus on the overall connec Ɵ vity of our neighborhoods. We 
will provide Rochesterians with the needed access to reliable, a ﬀ ordable transporta Ɵ on 
that provides opportuni Ɵ es for employment, 
child care, health care, educa Ɵ on, as well as 
all of the other services residents and families need. As men Ɵ oned previously, Rochester 
has the second-highest poverty rate in the naƟ on, resul Ɵ ng in a situa Ɵ on that threatens 
our community’s economic future. Enhanced mobility is one avenue to help turn this situaƟ on around.
 »Rochester will test automated vehicle performance in a four-season climate. 
 »Rochester will demonstrate that an enhanced transit service can make a posiƟ ve impact on low income residents. 
 »Rochester will provide real- Ɵ me traveler 
informaƟ on and emerging mobility services 
to improve personal mobility. 
 »Rochester will increase mobility for pedestrian and bicycle access. »Rochester will focus mobility improvements on our overall demographics (e.g. aging popula Ɵ on, 
disabled, millennials, etc.). 
Rochester will improve safety.
By using advanced technologies, including CV technologies, Rochester will reduce the number and severity of collisions, resul Ɵ ng in 
fewer fataliƟ  es and injuries.E ﬃ  ciency is at the 
forefront of Rochester’s vision for the future. 
Rochester will focus on crea Ɵ ng a connected 
community that will provide the infrastructure 
for the future. 
 »In the 21st Century, everyone needs the ability to be connected and therefore the City of Rochester will be incorpora Ɵ ng a 
City-wide Wi-Fi network. 
 »Smart Road technology will also be incorporated to make sure that every signalized intersec Ɵ on within the City of 
Rochester has the ability to adapt to the changing tra ﬃ  c condiƟ ons. 
Rochester will build for a 
sustainable future. 
Rochester’s primary goal is to build a thriving 
liveable community throughout the city that provides access, neighborhood cohesion, opportunity, economic compe Ɵ Ɵ veness, and a 
“sense of place.” 
Rochester will adapt to a changing 
climate. 
The technologies implemented by the City 
of Rochester will support a more sustainable relaƟ onship between transporta Ɵ on and the 
environment through fuel use and emissions reducƟ  ons. 
Upon selecƟ  on as a Smart City Challenge 
Finalist, the City of Rochester will work with our consor Ɵ um partners to iden Ɵ fy a set of 
targeted performance measures that relate to the primary impact of our deployment. The deployed technologies will be capable of generaƟ ng the data needed to demonstrate 
how well the system is performing with respect to the iden Ɵ ﬁ ed target measures. 
City of Rochester, NY | 27ROC FORWARD»»»EVIDENCE OF 
CAPACITY
The City of Rochester has a long history of delivering high-quality, large-scale public projects u Ɵ lizing federal funding. The most 
current example of this is the Inner Loop East Transforma Ɵ on project, currently under 
construcƟ  on. This $24 million project received 
$17.7 million in TIGER funding in 2013 to remove a deteriorated and underu Ɵ lized 
secƟ on of the Inner Loop Expressway in 
Downtown Rochester and replace it with a new high quality complete street. This project will reconnect neighborhoods, remove structurally-de ﬁ cient bridges, encourage 
walking and biking, and create over six acres of land for redevelopment that will generate jobs and leverage private investment. This project is being developed by the City of Rochester on schedule and on budget. Other Recent examples of major federally-funded City transporta Ɵ on projects include:
 »Midtown Rising Redevelopment , a $100 
million project, is signi ﬁ cantly shaping the 
rebirth of the downtown core through major public and private investment, job creaƟ on, and infrastructure 
development. At the heart of the project is the rehabilita Ɵ on of the nearly 9-acre 
former Midtown Plaza into a mixed-use area designed to a Ʃ ract a criƟ  cal 
mass of residents and 24/7 ameni Ɵ es 
that contribute to a vibrant live-work environment. This project has created a resurgence of downtown acƟ  vity and is 
currently rede ﬁ ning Rochester’s City Center 
for future genera Ɵ ons. 
 »The Broad Street Tunnel Reconstruc Ɵ on 
project , a $23 million project completed 
in 2011 which ﬁ lled in a deteriora Ɵ ng 
subsurface tunnel and fully reconstructed a major surface arterial. 
 »The Port of Rochester Infrastructure Improvements project , a $40 million 
project that constructed new streets, sidewalks, ligh Ɵ ng, drainage, parking, 
mulƟ -use trails, and public space on 
a previously-unde ﬁ ned parking area 
surrounding the historic Port Terminal Building. 
Ground Breaking Ceremony for the Inner Loop East Transforma Ɵ on Project
City of Rochester, NY | 28ROC FORWARD»»»ExecuƟ  ve Commitment:  The City of Rochester 
will be the grant recipient and primary point 
of contact responsible for federal grant administra Ɵ on and repor Ɵ ng procedures. 
Mayor Lovely Warren, as demonstrated by the cover leƩ er to this applica Ɵ on, is commi Ʃ ed to 
successful delivery of our Smart City vision.
Workforce Capacity:  The City of Rochester has 
an excellent working rela Ɵ onship with local 
labor unions. In fact, for three of the projects 
listed above, the City developed project labor agreements (PLA’s) with the local unions to assure that su ﬃ  cient workforce capacity is 
available in the Region. The City of Rochester, along with the local unions, is very proud of their teaming abili Ɵ es and past successes. 
Likewise, the region has well-established partnerships for workforce development through regional academic partners such as Monroe Community College. Should Rochester be chosen as a Smart City Challenge ﬁ nalist, 
the City will work with regional partners to create a workforce development strategy to ensure that the local labor force is ready and equipped for the economic opportuni Ɵ es that 
will arise.
Degree of Infrastructure Readiness:  The 
transporta Ɵ on infrastructure of the City of 
Rochester is already well-prepared to meet the 
needs of the Smart City Challenge. The tra ﬃ  c 
signal system is computerized and coordinated remotely from the Regional Tra ﬃ  c OperaƟ ons 
Center, where tra ﬃ  c monitoring capabili Ɵ es 
are acƟ ve 24/7. Likewise, the RTS transit ﬂ  eet 
is ouƞ iƩ ed with CAD/AVL and provides real-
Ɵ me arrival and status informa Ɵ on to the 
public through mul Ɵ ple plaƞ orms. There is an 
expansive municipal ﬁ ber network in the city 
with excess capacity.
Data & Performance Management 
CapabiliƟ es: The City and consor Ɵ um 
partners already collect and analyze data for a wide variety of municipal applica Ɵ ons and 
public informa Ɵ on. The City’s Department 
of Informa Ɵ on Technology is well aware of 
the Smart City Challenge and is prepared to accommodate any and all requirements in coordinaƟ on with our partners.LEVERAGING FEDERAL RESOURCES
It is anƟ cipated that opportuni Ɵ es for cost-
sharing and in-kind service delivery will be made available through the City and its project partners. The ability to leverage the federal resources provided through the Smart City Challenge to a Ʃ ract addi Ɵ onal ﬁ nancial and 
technical assistance will help to ensure that Rochester’s Smart City vision produces a real and long-las Ɵ ng impact on Rochester, New 
York State, and the na Ɵ on as a whole. Upon 
noƟ ﬁ caƟ on as a Smart City Challenge ﬁ nalist, 
the City will work with our consor Ɵ um of 
partners to secure commitments to leverage addiƟ onal funding and/or in-kind products and 
services. 
ROC Forward: creaƟ  ng a smart, sustainable 
city for the 21st Century. 
City of Rochester, NY | 29ROC FORWARD»»»ROCHESTER CYCLING ALLIANCE
In partnership with
